<?xml version="1.0" encoding="UTF-8"?>
<xs:schema attributeFormDefault="unqualified" elementFormDefault="qualified" xmlns:xs="http://www.w3.org/2001/XMLSchema">
    <xs:element name="xmlSource">
        <xs:complexType>
            <xs:sequence>
                <xs:element name="markers" maxOccurs="unbounded" minOccurs="0">
                    <xs:complexType>
                        <xs:sequence>
                            <xs:element type="xs:string" name="name"/>
                            <xs:element type="xs:string" name="note"/>
                            <xs:element type="xs:byte" name="latitude"/>
                            <xs:element type="xs:byte" name="longitude"/>
                            <xs:element type="xs:date" name="date"/>
                        </xs:sequence>
                    </xs:complexType>
                </xs:element>
            </xs:sequence>
        </xs:complexType>
    </xs:element>
</xs:schema>
